{
  "$schema": "https://json-schema.org/draft/2020-12/schema",
  "title": "Stack Engine layout regression corpus",
  "type": "object",
  "additionalProperties": false,
  "required": ["$schema", "schemaVersion", "engineVersion", "performance", "cases"],
  "properties": {
    "$schema": { "const": "./schema.json" },
    "schemaVersion": { "const": "1.0" },
    "engineVersion": { "type": "string", "pattern": "^[0-9]+\\.[0-9]+\\.[0-9]+$" },
    "performance": { "$ref": "#/$defs/performance" },
    "cases": {
      "type": "array",
      "minItems": 6,
      "maxItems": 24,
      "items": { "$ref": "#/$defs/case" }
    }
  },
  "$defs": {
    "performance": {
      "type": "object",
      "additionalProperties": false,
      "required": [
        "warmupIterations",
        "measuredIterations",
        "maxP95Milliseconds",
        "maxSuiteMilliseconds"
      ],
      "properties": {
        "warmupIterations": { "type": "integer", "minimum": 1, "maximum": 20 },
        "measuredIterations": { "type": "integer", "minimum": 5, "maximum": 100 },
        "maxP95Milliseconds": { "type": "integer", "minimum": 1, "maximum": 1000 },
        "maxSuiteMilliseconds": { "type": "integer", "minimum": 10, "maximum": 10000 }
      }
    },
    "case": {
      "type": "object",
      "additionalProperties": false,
      "required": [
        "id",
        "title",
        "summary",
        "density",
        "source",
        "snapshot",
        "features",
        "providerFixture",
        "expected",
        "alt"
      ],
      "properties": {
        "id": { "type": "string", "pattern": "^[a-z][a-z0-9-]{0,63}$" },
        "title": { "type": "string", "minLength": 1, "maxLength": 80 },
        "summary": { "type": "string", "minLength": 1, "maxLength": 180 },
        "density": { "enum": ["small", "medium", "dense"] },
        "source": { "type": "string", "pattern": "^sources/[a-z0-9-]+\\.stack$" },
        "snapshot": { "type": "string", "pattern": "^snapshots/[a-z0-9-]+\\.svg$" },
        "features": {
          "type": "array",
          "minItems": 1,
          "uniqueItems": true,
          "items": {
            "enum": [
              "groups",
              "nested-groups",
              "layout-direction",
              "rank-constraints",
              "order-constraints",
              "cross-edges",
              "edge-labels",
              "long-labels",
              "dense-graph",
              "provider-icons",
              "mixed-edge-kinds",
              "multilingual-text"
            ]
          }
        },
        "providerFixture": {
          "oneOf": [
            { "type": "null" },
            { "type": "string", "pattern": "^\\.\\./tests/fixtures/[a-z0-9-]+\\.json$" }
          ]
        },
        "expected": { "$ref": "#/$defs/expected" },
        "alt": { "type": "string", "minLength": 1, "maxLength": 180 }
      }
    },
    "expected": {
      "type": "object",
      "additionalProperties": false,
      "required": ["nodes", "groups", "edges", "providerNotices"],
      "properties": {
        "nodes": { "type": "integer", "minimum": 1, "maximum": 40 },
        "groups": { "type": "integer", "minimum": 0, "maximum": 12 },
        "edges": { "type": "integer", "minimum": 0, "maximum": 80 },
        "providerNotices": { "type": "integer", "minimum": 0, "maximum": 8 }
      }
    }
  }
}
